{"schema_version":"v1","id":"ev-v2-041-secrets-gate","kind":"evidence","created_at":"2026-08-24T11:16:09Z","correlation_id":"v2-041-secrets-gate","task_id":"V2-041","component":"environment","evidence_key":"97c3639335d156c77738f43cf9996b5988b695c3c67de78b58c5f08a8745e253","result":"passed","checks":[{"name":"secrets","status":"passed","argv":["devbox","run","--pure","--","make","secrets"],"working_directory":".","timeout_seconds":600,"summary":"no leaks found at the integrated commit with the AND-scoped allowlist in place"},{"name":"positive-control-outside-allowlisted-path","status":"passed","argv":["devbox","run","--pure","--","gitleaks","git","--no-banner","--redact"],"working_directory":".","timeout_seconds":600,"summary":"a 64-hex secret committed under internal/quota/ is still reported by generic-api-key with the allowlist active; without any config the same scan reports 25 findings, and with the conditions merely listed (default OR) it reported none, which is why condition=AND is required"},{"name":"positive-control-inside-allowlisted-path","status":"passed","argv":["devbox","run","--pure","--","gitleaks","git","--no-banner","--redact"],"working_directory":".","timeout_seconds":600,"summary":"a non-hex secret committed under .agents/v2/evidence/ is still reported, proving the path alone does not suppress findings"},{"name":"clean-tree","status":"passed","argv":["devbox","run","--pure","--","gitleaks","git","--no-banner","--redact"],"working_directory":".","timeout_seconds":600,"summary":"after removing both probe commits the scan reports no leaks found"},{"name":"check","status":"passed","argv":["devbox","run","--pure","--","make","check"],"working_directory":".","timeout_seconds":2400,"summary":"common validation entrypoint green, validated after committing so that the secret scan reads the committed history"},{"name":"ownership","status":"passed","argv":["devbox","run","--pure","--","make","ownership"],"working_directory":".","timeout_seconds":600,"summary":".gitleaks.toml is owned by exactly one component (environment)"},{"name":"actionlint","status":"passed","argv":["devbox","run","--pure","--","actionlint",".github/workflows/ci.yml"],"working_directory":".","timeout_seconds":300,"summary":"the workflow that now runs make secrets on every v2 push lints clean"}],"observed_at":"2026-08-24T11:16:09Z"}