{
 "schema_version": "v1",
 "id": "ev-v2-046-workspace-confinement",
 "kind": "evidence",
 "created_at": "2026-08-25T08:35:00Z",
 "correlation_id": "v2-046-workspace-confinement",
 "task_id": "V2-046",
 "component": "runner",
 "evidence_key": "05acfb0457685c56142d7a6077ed91565fbbcb802a8d64e28da20492dfe1b7bf",
 "result": "passed",
 "checks": [
  {
   "name": "kernel-and-unshare-execution-facts",
   "status": "passed",
   "argv": ["uname", "-r"],
   "working_directory": ".",
   "timeout_seconds": 10,
   "summary": "Kernel version measured directly: 6.18.33.2-microsoft-standard-WSL2, linux/amd64. TestNamespaceConfinementProbeReportsExecutionFacts independently logs the same kernel version plus 'unshare probe SUCCEEDED (bind mount, remount ro, tmpfs mount all worked inside a fresh unprivileged user+mount namespace)' from inside go test itself, so this is a recorded execution fact, not an assumption: the confinement tests below were not skipped, on this kernel, in this run."
  },
  {
   "name": "confinement-suite-verbose-non-skipped",
   "status": "passed",
   "argv": ["devbox", "run", "--pure", "--", "go", "test", "-count=1", "-v", "./internal/runner"],
   "working_directory": ".",
   "timeout_seconds": 600,
   "summary": "39 top-level test functions: 38 PASS, 1 SKIP. The 1 skip is TestHelperProcessJournalAppendAndBlock, a pre-existing (V2-016) helper-process body guarded by an env var that is always skipped under a normal `go test` run -- unrelated to namespace support and unrelated to this task. All 3 new confinement tests ran and PASSed with zero skips: TestNamespaceConfinementProbeReportsExecutionFacts (logs kernel version and unshare probe success), TestNamespaceConfinementProvesWorkspaceWriteContainment (the containment proof), TestNamespaceConfinementRejectsRelativeWorkspaceWithoutRunningChild (fail-closed proof). Every pre-existing test name in the package still PASSes unchanged, in particular TestSupervisorCancelsProcessGroupTERMThenKILL and TestJournalSurvivesRealSIGKILLOfProcessGroup (the real SIGKILL test), neither of which was modified."
  },
  {
   "name": "containment-proof-detail",
   "status": "passed",
   "argv": ["devbox", "run", "--pure", "--", "go", "test", "-count=1", "-v", "-run", "TestNamespaceConfinementProvesWorkspaceWriteContainment", "./internal/runner"],
   "working_directory": ".",
   "timeout_seconds": 60,
   "summary": "Real child process run via ProcessSupervisor{Confine: &NamespaceConfinement{Workspace: ws}}. Observed and asserted from the child's own captured marker files (not inferred from exit code alone): (1) write inside workspace succeeds (exit 0, file created). (2) write to a sibling path under the same top-level ancestor, outside workspace, fails; the child's own stderr, captured verbatim, reads 'outside/outside.txt: Read-only file system' (EROFS surfaced by the kernel through dash's own redirection-failure message). (3) positive control: the identical write, same paths, run via a plain ProcessSupervisor{} with no Confine, succeeds -- ruling out 'that path was never writable anyway'. (4) after ProcessSupervisor.Run returns (the ephemeral mount namespace already torn down by the kernel), the outside file still does not exist -- checked both immediately after the confined failure and again after the process exited."
  },
  {
   "name": "fail-closed-on-unusable-confinement",
   "status": "passed",
   "argv": ["devbox", "run", "--pure", "--", "go", "test", "-count=1", "-v", "-run", "TestNamespaceConfinementRejectsRelativeWorkspaceWithoutRunningChild", "./internal/runner"],
   "working_directory": ".",
   "timeout_seconds": 60,
   "summary": "ProcessSupervisor.Run refuses to start the child at all (no marker file is ever created) when NamespaceConfinement cannot be legitimately set up, proving the non-goal 'never silently run unconfined' rather than merely documenting it."
  },
  {
   "name": "gofmt-clean",
   "status": "passed",
   "argv": ["devbox", "run", "--pure", "--", "gofmt", "-l", "."],
   "working_directory": ".",
   "timeout_seconds": 60,
   "summary": "Empty output."
  },
  {
   "name": "runner-race-clean",
   "status": "passed",
   "argv": ["devbox", "run", "--pure", "--", "go", "test", "-count=1", "-race", "./internal/runner"],
   "working_directory": ".",
   "timeout_seconds": 600,
   "summary": "ok, race-clean, including the new real-subprocess confinement tests."
  },
  {
   "name": "runner-determinism-3x",
   "status": "passed",
   "argv": ["devbox", "run", "--pure", "--", "go", "test", "-count=1", "./internal/runner"],
   "working_directory": ".",
   "timeout_seconds": 300,
   "summary": "Executed three times in sequence; verdict was 'ok  github.com/takushi/agentic-loop-foundation/v2/internal/runner' every time (only wall-clock timing differed). No fixed sleep, no timer, no goroutine in the new tests; synchronisation is bounded-deadline polling on marker files the child writes itself, matching this package's existing convention (waitForPath/waitForConfinementMarker)."
  },
  {
   "name": "component-runner-green",
   "status": "passed",
   "argv": ["devbox", "run", "--pure", "--", "make", "component-runner"],
   "working_directory": ".",
   "timeout_seconds": 600,
   "summary": "go test ./cmd/runner ./cmd/bootstrap ./internal/domain ./internal/runner all ok."
  },
  {
   "name": "candidate-check-full",
   "status": "passed",
   "argv": ["devbox", "run", "--pure", "--", "make", "check"],
   "working_directory": ".",
   "timeout_seconds": 2400,
   "summary": "Run after committing this task's changes (commit 5e73097 on v2-task/V2-046), so the evidence key below and gitleaks' git history scan both reflect the final tree. environment, format, lint, test (full ./... suite, every package ok), contracts, docs, secrets (gitleaks: 412 commits scanned, no leaks found), ownership, component-store-firestore and workflow-pins all passed with no Error from make and no failing target."
  },
  {
   "name": "evidence-keys-runner-at-committed-tree",
   "status": "passed",
   "argv": ["devbox", "run", "--pure", "--", "make", "evidence-keys"],
   "working_directory": ".",
   "timeout_seconds": 600,
   "summary": "Read after `git add`/commit of internal/runner/confinement.go, internal/runner/confinement_test.go, internal/runner/supervisor.go and docs/operations/runner-local.md, since evidenceKey() enumerates a component's files via `git ls-files` and would otherwise omit new, untracked files. runner component evidence_key = 05acfb0457685c56142d7a6077ed91565fbbcb802a8d64e28da20492dfe1b7bf, matching this record's top-level evidence_key."
  }
 ],
 "observed_at": "2026-08-25T08:35:00Z"
}
