{
 "schema_version": "v1",
 "id": "ev-v2-072-docs",
 "kind": "evidence",
 "created_at": "2026-08-26T09:00:00Z",
 "correlation_id": "v2-072-forge-write",
 "task_id": "V2-072",
 "component": "docs",
 "evidence_key": "4647848d1ab46cea58ccf31c0df745690922703a40e0e9de2e4d66a7bb7ceb6a",
 "result": "passed",
 "observed_at": "2026-08-26T09:00:00Z",
 "checks": [
  {
   "name": "environment-identifier",
   "status": "passed",
   "argv": [
    "uname",
    "-srm"
   ],
   "working_directory": ".",
   "timeout_seconds": 10,
   "summary": "execution environment: uname -srm = Linux 6.18.33.2-microsoft-standard-WSL2 x86_64; devbox run --pure -- go version = go1.25.0 linux/amd64; devbox 0.17.2, environment resolved from this worktree's devbox.json/devbox.lock, both untouched by this task; resolved absolute git path = /home/takushi/repos/agentic-loop-foundation-worktrees/v2-task-072/.devbox/nix/profile/default/bin/git, git version 2.55.0; resolved absolute unshare path = /home/takushi/repos/agentic-loop-foundation-worktrees/v2-task-072/.devbox/nix/profile/default/bin/unshare, unshare from util-linux 2.42.2; gh is ABSENT from the validated devbox --pure PATH and present at /usr/bin/gh, gh version 2.92.0 (2026-04-28), which is why absolute path resolution is required rather than defensive; worktree /home/takushi/repos/agentic-loop-foundation-worktrees/v2-task-072 on branch v2-task/V2-072, base commit 47b53c9, code commit 67d2543. No real Provider CLI was started, NO gh child was started at any point, and no Google Cloud resource was touched. The only external process any check started is the real git binary and the real unshare, both inside the rootless user+mount namespace, plus the local Firestore emulator scripts/firestore-emulator.sh starts for make component-store-firestore."
  },
  {
   "name": "component-docs",
   "status": "passed",
   "argv": [
    "devbox",
    "run",
    "--pure",
    "--",
    "make",
    "component-docs"
   ],
   "working_directory": ".",
   "timeout_seconds": 600,
   "summary": "Verdict: the target is '! rg -n TODO\\(ci\\) docs README.md' and it exited 0 with no output; the underlying rg exits 1 because it finds nothing, which is the intended sense of the negation. docs/operations/forge-publication.md is the only file under docs/ that changed: git diff --stat over docs names exactly that one new file. docs/operations/v2-task-dag.md, v2-bootstrap.md and runner-local.md are byte-identical, and so are docs/product/**, docs/preview/**, docs/policies/**, docs/stable/**, docs/principles.md, docs/architecture/**, README.md and AGENTS.md."
  },
  {
   "name": "document-of-record",
   "status": "passed",
   "argv": [
    "devbox",
    "run",
    "--pure",
    "--",
    "rg",
    "-n",
    "^## ",
    "docs/operations/forge-publication.md"
   ],
   "working_directory": ".",
   "timeout_seconds": 600,
   "summary": "A32, PASSED. docs/operations/forge-publication.md covers every item A32 names, one section each: what is published and from where (the verified commit, and the registered-Repository-only target); the reserved branch prefix and the ref naming rule, with the two measured workflow branch filters; the four content-addressed equalities, including the statement that the local and published commit object names are recorded and their agreement is NOT required; create-only, never updated, never forced, with the closed operation list and the absence of a force key as the mechanism; the three outcomes as a table and where needs-input goes, plus the statement that this task does not move the Requirement to needs-input; credentials, output and confinement, including the named admission that the forge child is not filesystem-confined and why that bounds nothing; the exact owner-run command that deletes a published ref, followed by the TWO RESIDUES deletion does not remove (objects reachable by object name, and the repository's own activity entry); the gate variables in a table with the statement that the target is owner-designated with NO default and in particular no default to the Loop's own repository; and the statement that NO production loop calls Dispatch yet. No digest value is written anywhere in the document. No other document was edited."
  }
 ]
}
