{"schema_version":"v1","id":"ev-v2-003","kind":"evidence","created_at":"2026-08-22T00:00:00Z","correlation_id":"v2-bootstrap","task_id":"V2-003","component":"contracts","evidence_key":"3333333333333333","result":"passed","checks":[{"name":"contracts","status":"passed","argv":["make","contracts"],"working_directory":".","timeout_seconds":120,"summary":"Schema and fixture validation passed"}],"observed_at":"2026-08-22T00:00:00Z"}
