{"schema_version":"v1","id":"ev-v2-062-ledger-boundary","kind":"evidence","created_at":"2026-08-25T01:36:10Z","correlation_id":"v2-062-ledger-boundary","task_id":"V2-062","component":"docs","evidence_key":"4bc220df556359858653359fdccd689bf4ba87e6f476a27915eed081886db41e","result":"passed","observed_at":"2026-08-25T01:36:10Z","checks":[{"name":"make-docs","status":"passed","argv":["devbox","run","--pure","--","make","docs"],"working_directory":".","timeout_seconds":600,"summary":"exit 0, no output; the two rg negative-guards (forbidden links to 01-core-principles.md and to the other numbered spec docs) found no matches in docs/README.md/AGENTS.md after the new section was added to docs/operations/provider-live-claude.md."},{"name":"make-component-docs","status":"passed","argv":["devbox","run","--pure","--","make","component-docs"],"working_directory":".","timeout_seconds":600,"summary":"exit 0, no output; the rg negative-guard for TODO(ci) markers in docs/README.md found no matches."},{"name":"go-test-contracts","status":"passed","argv":["devbox","run","--pure","--","go","test","-count=1","./internal/contracts"],"working_directory":".","timeout_seconds":600,"summary":"ok  \tgithub.com/takushi/agentic-loop-foundation/v2/internal/contracts\t0.054s -- includes TestActiveEvidenceIndex, which validates this record and index.json against contracts/schemas/evidence.json and evidence-index.json and checks the active-evidence bijection and the task_id->task-state back-reference."},{"name":"make-evidence-keys","status":"passed","argv":["devbox","run","--pure","--","make","evidence-keys"],"working_directory":".","timeout_seconds":600,"summary":"computed against the tree of the commit that carries this task's changes; docs=4bc220df556359858653359fdccd689bf4ba87e6f476a27915eed081886db41e. The docs component's roots (docs/**, README.md, AGENTS.md) do not include .agents/v2/evidence/**, so adding this evidence record and its index entry does not change the docs key."},{"name":"make-check","status":"passed","argv":["devbox","run","--pure","--","make","check"],"working_directory":".","timeout_seconds":1800,"summary":"all make check targets (environment, format, lint, test, contracts, docs, secrets, ownership, component-store-firestore, workflow-pins) reported success: every `go test` package printed ok or [no test files] with no FAIL, gitleaks reported \"no leaks found\" after scanning 427 commits, and workflow-pins reported \"3 unique (owner/repo, version) -> sha pins, no disagreement\". Run once pre-commit against the exact file content that was then committed, and re-run after the commit with an identical result since make check reads working-tree content, not git history."},{"name":"scope-note","status":"passed","argv":["git","diff","--stat","fa38f0f..HEAD"],"working_directory":".","timeout_seconds":60,"summary":"this task did not change the ledger implementation. It only documents an existing boundary: the diff touches exactly docs/operations/provider-live-claude.md (one new section appended) and the two evidence files required by this task (.agents/v2/evidence/V2-062-ledger-boundary.json, .agents/v2/evidence/index.json). No file under internal/**, contracts/**, or any other component was modified."}]}
