{"schema_version":"v1","id":"ev-v2-045-environment","kind":"evidence","created_at":"2026-08-25T02:20:00Z","correlation_id":"v2-045-dependency-surface","task_id":"V2-045","component":"environment","evidence_key":"e03b08eba9794f663cf804737e6b585c4bc9c9d238d940321419dd65a68bc4d6","result":"passed","observed_at":"2026-08-25T02:20:00Z","checks":[{"name":"component-tooling","status":"passed","argv":["make","component-tooling"],"working_directory":".","timeout_seconds":1800,"summary":"The inner invocation cmd/ci-plan executed for this component during make evidence-all at base_commit=e37a2456ca386a062cff96441d79a7678a143b6c. The planner runs exactly argv=[make component-tooling] and writes build/evidence/environment-<key>.json only if it exits zero. component=environment evidence_key=e03b08eba9794f663cf804737e6b585c4bc9c9d238d940321419dd65a68bc4d6 base_commit=e37a2456ca386a062cff96441d79a7678a143b6c."},{"name":"go-clean-testcache","status":"passed","argv":["devbox","run","--pure","--","go","clean","-testcache"],"working_directory":".","timeout_seconds":600,"summary":"Executed once before make evidence-all. make component-<id> does not pass -count=1, so without clearing the test cache an inner invocation could report a cached result. Clearing it makes every inner check in this run a real execution."},{"name":"evidence-all","status":"passed","argv":["devbox","run","--pure","--","make","evidence-all","EVIDENCE_TASK_ID=V2-045","EVIDENCE_CORRELATION_ID=v2-045-dependency-surface"],"working_directory":".","timeout_seconds":3600,"summary":"Outer invocation that produced this record's key. It selected all 23 components (--all) and ran each component's check target. Verdict line: {\"changed\":null,\"selected\":[...23 ids...],\"all\":true}; 23 record files in build/evidence."},{"name":"evidence-key-covers-dependency-surface","status":"passed","argv":["devbox","run","--pure","--","make","evidence-keys"],"working_directory":".","timeout_seconds":600,"summary":"Read at base_commit=e37a2456ca386a062cff96441d79a7678a143b6c after git add, so no new file was invisible to git ls-files. Key closure of environment = [environment] (1 components, 10 patterns) plus the 7 unconditional paths [Makefile ci/components.json ci/key-closure.json devbox.json devbox.lock go.mod go.sum]. dependencies=[] verification_dependencies=[]. Pre-change key at 26a499d was af5c5820295dfbd0fdf490bc5c583ded0c22fe02b05366e4f547740a417e66ba; the new key is e03b08eba9794f663cf804737e6b585c4bc9c9d238d940321419dd65a68bc4d6. One-byte probe on internal/application/service.go: pre-change key did NOT move, new key does not move (application is not in this closure). One-byte probe on Makefile: new key moves (pre-change algorithm moved only the environment component)."}]}