{"schema_version":"v1","id":"ev-v2-064-docs","kind":"evidence","created_at":"2026-08-25T02:37:42Z","correlation_id":"v2-064-repository-and-forge","task_id":"V2-064","component":"docs","evidence_key":"5d92f240bb848faf9f1ee0c10e7376118ee692bd52c55f96e80af17f4128aca5","result":"passed","observed_at":"2026-08-25T02:37:42Z","checks":[{"name":"environment-identifier","status":"passed","argv":["uname","-srm"],"working_directory":".","timeout_seconds":10,"summary":"execution environment: uname -srm = Linux 6.18.33.2-microsoft-standard-WSL2 x86_64; devbox run --pure -- go version = go1.25.0 linux/amd64; devbox 0.17.2, environment resolved from this worktree's devbox.json/devbox.lock, both untouched by this task; worktree /home/takushi/repos/agentic-loop-foundation-worktrees/v2-task-064 on branch v2-task/V2-064, base commit 5610066."},{"name":"domain-model-repository-subsection","status":"passed","argv":["sed","-n","30,48p","docs/architecture/domain-model.md"],"working_directory":".","timeout_seconds":30,"summary":"One narrow edit inside the '### Repository' subsection only (A19). The bullet '- source locatorとdefault branch' is elaborated into the implemented shape -- forge (github only today), host, owner, name, default_branch as a value object -- and now states that uniqueness is judged on the normalised (forge, owner, name) triple, that the clone URL is never the key, that normalisation lowercases host/owner/name and strips a trailing .git so https, ssh and scp forms are one locator, that a URL's userinfo section is dropped at parse time so a credential-bearing URL form cannot reach a canonical record, and that a rename or transfer does not change the Repository's identity. The '- `repository_id`' bullet now says it is a loop-issued opaque identifier and that the clone URL is not the identifier. One new bullet answers the concurrency question the document previously left unspecified: 'optimistic concurrency用`version`', mirroring Requirement's own attribute list at L59, and noting that the registered->retired transition also advances it. Diff stat for the file: 9 changed lines (8 added, 1 replaced). No other section and no other document was changed."},{"name":"runner-local-forge-adapter-section","status":"passed","argv":["git","diff","--cached","--stat","--","docs/operations/runner-local.md"],"working_directory":".","timeout_seconds":30,"summary":"+43 lines: one new section 'Forge adapter: gh subprocess, absolute path, credential as an absence (V2-064)', inserted between the Secret Broker section and the bounded diagnostic log section so it sits with the existing V2-016/V2-017 runner-local measurements (A19). It records the measured facts: gh absent from the devbox run --pure PATH while git is present (with the measured paths and gh version 2.92.0), absolute-path resolution through the existing resolveTool helper with the filepath.Base assertion applied before the existence check, credential isolation proven as an absence with granted_names empty and the guarded base environment measured as {HOME, PATH}, the read-only argv forms and the fact that no stdout or stderr is ever returned verbatim, and the AST proof that the Control Plane never invokes gh or git. It also records, explicitly as input for the later push leg rather than as work done here, that no git credential.helper is configured at repository, global or system scope and that gh auth git-credential exists in gh 2.92.0. No other section of that document changed."},{"name":"preview-capabilities-not-touched","status":"passed","argv":["git","status","--short","docs/preview/","docs/product/","docs/policies/","docs/principles.md","docs/architecture/overview.md"],"working_directory":".","timeout_seconds":30,"summary":"empty output. docs/preview/capabilities.md is deliberately not touched: cap-repository-registration is still not Preview-proven and its prose is still accurate (A19). Every other prohibited document root is likewise untouched."},{"name":"make-docs","status":"passed","argv":["devbox","run","--pure","--","make","docs"],"working_directory":".","timeout_seconds":600,"summary":"no output, which is this target's green verdict: both rg negative-guards found zero matches after the two edits."},{"name":"make-component-docs","status":"passed","argv":["devbox","run","--pure","--","make","component-docs"],"working_directory":".","timeout_seconds":600,"summary":"no output: the rg negative-guard for TODO(ci) markers in docs, README.md and AGENTS.md found no matches."},{"name":"evidence-key","status":"passed","argv":["devbox","run","--pure","--","make","evidence-keys"],"working_directory":".","timeout_seconds":600,"summary":"docs=5d92f240bb848faf9f1ee0c10e7376118ee692bd52c55f96e80af17f4128aca5, read on the tree this task committed with every touched file already git-added. The docs component's roots are docs/**, README.md and AGENTS.md; they do not include .agents/v2/evidence/**, so adding this evidence record and its index entry does not move the key."}]}