{"schema_version":"v1","id":"ev-v2-009-release-contract","kind":"evidence","created_at":"2026-08-24T11:18:58Z","correlation_id":"v2-040-release-contract-evidence","task_id":"V2-040","component":"release","evidence_key":"a7e85c5263ca2eb4b570fac695d3cf0bb2302666f09565c4242914d852d43f28","result":"passed","checks":[{"name":"release-contract-baseline","status":"passed","argv":["devbox","run","--pure","--","go","test","-count=1","./internal/contracts","-run","TestFoundationReleaseContractBaseline"],"working_directory":".","timeout_seconds":600,"summary":"This evidence validates the V2-009 deliverable rc-foundation-0.1.0-baseline and cd-foundation-0.1.0-baseline; the producer is remediation task V2-040. Confirms the release contract test fixture asserts the foundation release contract baseline (rc-foundation-0.1.0-baseline, cd-foundation-0.1.0-baseline) is present and well-formed."},{"name":"release-contract-compile","status":"passed","argv":["devbox","run","--pure","--","go","test","-count=1","./internal/release","-run","TestCompileFoundationBaselineContract"],"working_directory":".","timeout_seconds":600,"summary":"Confirms the internal/release package compiles the foundation baseline release contract without error."},{"name":"component-contracts","status":"passed","argv":["devbox","run","--pure","--","make","component-contracts"],"working_directory":".","timeout_seconds":600,"summary":"Runs the contracts component test suite (./internal/contracts) covering the release contract schema and baseline fixtures."},{"name":"component-release","status":"passed","argv":["devbox","run","--pure","--","make","component-release"],"working_directory":".","timeout_seconds":600,"summary":"Runs the release component test suite (./internal/release, ./internal/domain) covering release contract compilation and domain invariants."},{"name":"ownership","status":"passed","argv":["devbox","run","--pure","--","make","ownership"],"working_directory":".","timeout_seconds":600,"summary":"Confirms every tracked file, including the release contract sources, is owned by exactly one component per the ci-plan ownership manifest."}],"observed_at":"2026-08-24T11:18:58Z"}
