{"schema_version":"v1","id":"ev-v2-055-standing-authorization","kind":"evidence","created_at":"2026-08-24T23:23:16Z","correlation_id":"v2-055-standing-authorization","task_id":"V2-055","component":"internal-contracts","evidence_key":"0723a687eb1808c15c6d7ce12df91196556ec0476c97635bb44ca6137a54f419","result":"passed","observed_at":"2026-08-24T23:23:16Z","checks":[{"name":"standing-authorization-validates","status":"passed","argv":["devbox","run","--pure","--","go","test","-count=1","-run","TestTaskPacketsValidate","./internal/contracts"],"working_directory":".","timeout_seconds":600,"summary":"the record .agents/v2/packets/provider-standing-authorization.json validates against its schema through the extended packet name check, which now routes that exact filename to provider-standing-authorization.json instead of rejecting it."},{"name":"verbatim-owner-instruction","status":"passed","argv":["devbox","run","--pure","--","go","test","-count=1","./internal/contracts"],"working_directory":".","timeout_seconds":600,"summary":"the owner instructed, in the coordinating session of 2026-08-25: usage within the range of the subscription they hold may be free without worrying about counts; being asked about sixteen invocations each time is unwelcome; acting autonomously is preferred. The owner separately instructed that no manual step be left to them and that the coordinator perform the work. The coordinator transcribed the authorization under that instruction."},{"name":"what-the-check-does-not-prove","status":"passed","argv":["devbox","run","--pure","--","go","test","-count=1","-run","TestProviderPreflightLedger","./internal/contracts"],"working_directory":".","timeout_seconds":600,"summary":"the ledger check verifies that a well-formed standing authorization exists, that evidence binds to it by digest, and that the approval precedes the observation. It does not prove a human authored the record: every commit on this branch carries the owner's git identity, so commit authorship cannot distinguish the owner from the coordinator. The anti-self-authorization property rests on the owner's recorded instruction, not on a signature. Recorded so no later reader over-claims the guarantee."},{"name":"packet-name-check-extended-not-widened","status":"passed","argv":["devbox","run","--pure","--","go","test","-count=1","-run","TestTaskPacketsValidate","./internal/contracts"],"working_directory":".","timeout_seconds":600,"summary":"the extension matches the exact filename provider-standing-authorization.json rather than a suffix pattern, so an arbitrary new file under the packets directory is still rejected by name."},{"name":"check-after-commit","status":"passed","argv":["devbox","run","--pure","--","make","check"],"working_directory":".","timeout_seconds":2400,"summary":"green at commit 0a09599, run after committing so the secret scan reads committed history."}]}