{
 "schema_version": "v1",
 "id": "ev-v2-065-docs",
 "kind": "evidence",
 "created_at": "2026-08-25T19:40:00Z",
 "correlation_id": "v2-065-human-input-surface",
 "task_id": "V2-065",
 "component": "docs",
 "evidence_key": "6ecab0de23b85e81f966fba9ed0b99aacc9602444f4a5fcdbfac3431ce58ff18",
 "result": "passed",
 "observed_at": "2026-08-25T19:40:00Z",
 "checks": [
  {
   "name": "environment-identifier",
   "status": "passed",
   "argv": [
    "uname",
    "-srm"
   ],
   "working_directory": ".",
   "timeout_seconds": 10,
   "summary": "execution environment: uname -srm = Linux 6.18.33.2-microsoft-standard-WSL2 x86_64; devbox run --pure -- go version = go1.25.0 linux/amd64; devbox 0.17.2, environment resolved from this worktree's devbox.json/devbox.lock, both untouched by this task; devbox run --pure -- git --version = git version 2.55.0; worktree /home/takushi/repos/agentic-loop-foundation-worktrees/v2-task-065 on branch v2-task/V2-065, base commit e01b771. No real Provider CLI was started, no gh was started and no Google Cloud resource was touched: the only store dependency exercised is the local Firestore emulator that scripts/firestore-emulator.sh starts for make component-store-firestore."
  },
  {
   "name": "component-docs",
   "status": "passed",
   "argv": [
    "devbox",
    "run",
    "--pure",
    "--",
    "make",
    "component-docs"
   ],
   "working_directory": ".",
   "timeout_seconds": 600,
   "summary": "Verdict: the target is '! rg -n TODO\\(ci\\) docs README.md' and it exited 0 with no output; the underlying rg exits 1 because it finds nothing, which is the intended sense of the negation. docs/preview/capabilities.md +27/-0 is the only file under docs/ that changed."
  },
  {
   "name": "capabilities-prose",
   "status": "passed",
   "argv": [
    "devbox",
    "run",
    "--pure",
    "--",
    "go",
    "test",
    "-count=1",
    "./internal/contracts",
    "./internal/release"
   ],
   "working_directory": ".",
   "timeout_seconds": 600,
   "summary": "A12, PASSED. Prose was appended inside the existing cap-human-input-request section of docs/preview/capabilities.md, following the section idiom the neighbouring capabilities already use: what the owner can now read, what this surface does and does not guarantee about claims, and the unwired residual. NO new <a id=...> anchor was added -- the anchor bijection asserted by TestCapabilityAnchorBijectionBothDirections and TestFoundationReleaseContractBaseline is intact and both are green -- no other capability section was touched, and no digest value was written into any document. docs/preview/index.md, docs/preview/stable-diff.md, docs/preview/README.md and docs/stable/** are untouched, and so are their release markers."
  },
  {
   "name": "residual-not-overclaimed",
   "status": "passed",
   "argv": [
    "devbox",
    "run",
    "--pure",
    "--",
    "rg",
    "-n",
    "cap-human-input-request",
    "docs/preview/capabilities.md"
   ],
   "working_directory": ".",
   "timeout_seconds": 60,
   "summary": "A13, RECORDED EXPLICITLY. This task wires the SURFACE ONLY. The automatic decision to ask is NOT implemented: the failure-model routes in docs/architecture/failure-model.md that send policy-denied, budget-exceeded and unclassifiable failures to needs-input have no wiring to Service.RequestHumanInput, and nothing in this task calls it outside tests. Therefore cap-human-input-request is NOT exercised by this task. Neither of the two prohibited overclaim phrases -- the one asserting that a capability was exercised, and the one asserting that a Preview journey passed -- was written anywhere in this task's diff as a claim: not in any evidence record, not in the documentation and not in the owner console. They occur in this diff only inside a test's forbidden-substring list in internal/api/api_test.go, which is the idiom three pre-existing sibling assertions in that same file already use to prove the absence, and which asserts the opposite of a claim. NAMED GAP FOR THE TECH LEAD: the trigger that decides a question is necessary is unwired, so the question can only be asked by an explicit call from a Runner or the scheduler; whoever owns the failure-model routing must connect the three failure classes to this command before the capability's Preview journey can be run."
  },
  {
   "name": "make-check-before-the-evidence-commit",
   "status": "passed",
   "argv": [
    "devbox",
    "run",
    "--pure",
    "--",
    "make",
    "check"
   ],
   "working_directory": ".",
   "timeout_seconds": 3600,
   "summary": "A19, first run, judged by the verdict lines rather than by the shell exit status. Zero FAIL lines; every package reports ok. Secret scan: '475 commits scanned. / scanned ~11379842 bytes (11.38 MB) in 924ms / no leaks found'. Ownership: {\"changed\":null,\"selected\":null,\"all\":false}. Firestore component under the emulator: ok .../internal/store/firestore 9.977s. Final line: 'workflow-pins: 3 unique (owner/repo, version) -> sha pins, no disagreement'."
  },
  {
   "name": "evidence-key",
   "status": "passed",
   "argv": [
    "devbox",
    "run",
    "--pure",
    "--",
    "make",
    "evidence-keys"
   ],
   "working_directory": ".",
   "timeout_seconds": 600,
   "summary": "A18: the docs component key read with make evidence-keys on the tree where make check is green and every touched file is already git-added is 6ecab0de23b85e81f966fba9ed0b99aacc9602444f4a5fcdbfac3431ce58ff18. Measured on the same tree, the key at base commit e01b771 was 007d2c5ad01e4810356605d48a02b6444e1d0710ba44a886e6aff8ca4aabd4f6, so this task moved it. 13 of the 23 component keys moved in total (api, application, contracts, control-plane, docs, internal-contracts, reconciler, release, runner, store-firestore, store-memory, task-ledger, web): the dependency closure carries the two edited application files into every component that depends on application, and contracts/openapi/openapi-v1.yaml into the api contract dependency and the release bundle. task-ledger moves once more when these evidence artifacts are committed, so A18's re-verification was run on the final committed tree 58868bc: this component's key above is UNCHANGED there, and task-ledger read 15cfd0d3508c6f3c77888c7764dfe12decea802aec56d76ca7eba34d3ec5c859. Both observations are kept."
  }
 ]
}
