{"schema_version":"v1","id":"ev-v2-018-update","kind":"evidence","created_at":"2026-08-25T03:47:17Z","correlation_id":"v2-018-m3-gate","task_id":"V2-018","component":"update","evidence_key":"bbb9962ce97e6de29bbe51c833c500af2b6be1979c6be34c6fd1b1ad852f702b","result":"passed","observed_at":"2026-08-25T03:47:17Z","checks":[{"name":"go-clean-testcache","status":"passed","argv":["devbox","run","--pure","--","go","clean","-testcache"],"working_directory":".","timeout_seconds":600,"summary":"Executed once immediately before make evidence-all. make component-<id> does not pass -count=1, so without clearing the test cache an inner invocation could report a cached result. Clearing it makes every inner check in this run a real execution."},{"name":"evidence-all","status":"passed","argv":["devbox","run","--pure","--","make","evidence-all","EVIDENCE_TASK_ID=V2-018","EVIDENCE_CORRELATION_ID=v2-018-m3-gate"],"working_directory":".","timeout_seconds":3600,"summary":"The M3 gate's G6 freshness re-issue, run at judgment commit ff605333c76dd1e252350dbc628301915d7637eb, whose tracked tree was clean (the only untracked outputs are under the git-ignored build directory). The planner selected all 23 components, executed each component's check target, exited zero, and wrote one record file per component under build/evidence, each named by its fresh key. Verdict line: {\"changed\":null,\"selected\":[api application ci contracts control-plane docs domain environment infra internal-contracts legacy-import provider reconciler release repository-meta runner scheduler store-firestore store-memory task-ledger tooling update web],\"all\":true}."},{"name":"component-update","status":"passed","argv":["make","component-update"],"working_directory":".","timeout_seconds":600,"summary":"Inner invocation cmd/ci-plan executed for this component during the run above. The planner runs exactly this argv and writes build/evidence/<component>-<key>.json only if it exits zero; that file exists for this component and carries evidence_key=bbb9962ce97e6de29bbe51c833c500af2b6be1979c6be34c6fd1b1ad852f702b identical to what make evidence-keys prints for it at the same commit. This record re-issues the component's passed evidence at the judgment commit so gate rule G6 binds the milestone's semantic records to the judged tree."}]}