{"schema_version":"v1","id":"ev-v2-000","kind":"evidence","created_at":"2026-08-22T00:00:00Z","correlation_id":"v2-bootstrap","task_id":"V2-000","component":"bootstrap","evidence_key":"0000000000000000","result":"passed","checks":[{"name":"baseline","status":"passed","argv":["true"],"working_directory":".","timeout_seconds":30,"summary":"Dedicated v2 worktree initialized"}],"observed_at":"2026-08-22T00:00:00Z"}
