{"schema_version":"v1","id":"ev-v2-010-domain","kind":"evidence","created_at":"2026-08-24T12:31:35Z","correlation_id":"v2-010-domain-invariants","task_id":"V2-010","component":"domain","evidence_key":"df57af1516e9984cef319a72e6756542905195b2af1e035ff7d3b3c9b870aefb","result":"passed","checks":[{"name":"domain-invariant-closure","status":"passed","argv":["devbox","run","--pure","--","go","test","-count=1","-v","./internal/domain"],"working_directory":".","timeout_seconds":120,"summary":"All 26 tests pass (16 pre-existing baseline tests unchanged plus 10 new closure tests). Invariant 1 (fencing/expiry) enumerates 9072 grid cells per function with 6 AcceptExecutionResult and 3 StartExecution success cells, all others rejected with an unmodified Execution. Invariant 2 (no side-effect permit survives an effective stop) is closed in three layers: L1 enumerates 810 Permit input cells (9 ControlMode x 10 PermitKind x 3 revision-relation x 3 fence-relation) and asserts Permit is total (err==nil iff Allowed()); within the 252 stop-mode x side-effect-kind cells, exactly 2 are allowed (the graceful-stop/PermitCheckpoint exception at exact revision) and 250 are denied. L2 performs breadth-first search over every ControlIntent sequence of length 1 to 4 over a 21-symbol alphabet (3 scopes x 7 modes), 204204 sequences and 806610 prefixes, recomputing EffectiveControl at every prefix; of 598296 stop-mode prefixes, 110622 side-effect checks are the same graceful-stop/checkpoint exception and 3479154 are denied. L3 closes the invariant unconditionally: across 5384664 direct EffectFromPermit attempts and 2399724 replay attempts (permits captured at an earlier, non-stop prefix and replayed after the stop takes effect) at every stop-mode prefix, the number of successfully constructed Effect values is exactly 0, because EffectFromPermit requires the re-read current control mode to be exactly ControlAllow independent of the PermitDecision's own Allowed() flag; this is the total function over the finite input relation that closes the claim, so the enumeration is a closure, not a sample. Invariant 3 performs breadth-first search to fixpoint over DecideRequirement (11 statuses x 9 commands): RequirementCompleted is confirmed unreachable (10 reached statuses, 29 accepted edges), every reached state has a zero StableSnapshot, CompleteRequirementFromRelease returns ErrInvalidTransition from all 10 non-evaluating statuses, ErrEvidenceIncomplete from evaluating with a zero-value proof, and RequirementCompleted with a fully cross-checked non-zero StableSnapshot from a proof produced by CompletePromotionWithProof. Forbidden transitions performs the same closure over DecideIncrement (12 statuses x 12 commands, all 12 statuses reached, 33 accepted edges) and asserts the accepted edge set equals a declared table transcribed from docs/architecture/domain-model.md section 5; both closures assert ErrStaleVersion and an unchanged state for a mismatched ExpectedVersion. Invariant 4 enumerates the full evidence-completeness product for a 3-capability release candidate (16 per-capability cases: present x Verified x Fresh x digest-agreement, cubed, crossed with RollbackEvidence x ResumeEvidence = 16384 grid cells) and confirms CanPromote succeeds for exactly 1 of 16384 cells; crossing that one fully-satisfied candidate with all 7 ControlMode values confirms PromoteRelease succeeds only under Allow and is denied with ErrControlDenied under the other 6, with no valid StableReleaseProof reachable from a denied promotion. Measured wall time for the whole ./internal/domain suite is under 0.5s, well inside the 30-second budget in docs/architecture/validation.md section 7. Running this argv three times in a row on this commit produced identical test-name/PASS-FAIL output (per-test and per-package wall-clock digits vary, as expected of a timer, but no test name, status, or count differed)."},{"name":"component-domain","status":"passed","argv":["devbox","run","--pure","--","make","component-domain"],"working_directory":".","timeout_seconds":120,"summary":"The domain component target runs go test ./internal/domain and reports ok. internal/domain is also exercised (directly or transitively) by component-control-plane, component-runner, component-reconciler and component-release; all five component targets were independently confirmed green with this change."},{"name":"domain-dependency-closure","status":"passed","argv":["devbox","run","--pure","--","go","list","-deps","./internal/domain"],"working_directory":".","timeout_seconds":60,"summary":"The transitive dependency set of internal/domain is standard library only: every listed path is either the package itself or an unversioned Go standard-library/runtime-internal path (errors, fmt, sort, strings, time, and their own stdlib dependencies). No third-party module path (no dot-containing host/org path outside github.com/takushi/agentic-loop-foundation/v2 itself) appears anywhere in the closure."},{"name":"evidence-keys","status":"passed","argv":["devbox","run","--pure","--","make","evidence-keys"],"working_directory":".","timeout_seconds":120,"summary":"Executed at commit A (a2c191e9321dc11e3f06deac48ba7d79a23f0933) with a clean working tree after `rm -rf build/evidence`. Reports evidence_key for the domain component as 7a3448a0ce3877ec5131974e3abf5c7acb8d9c07c17a27221a1a4e54dc62ed20, which is the value recorded above and in the index entry for this artifact. This is a key-listing run only; it performs no verification of its own."},{"name":"internal-contracts","status":"passed","argv":["devbox","run","--pure","--","go","test","-count=1","./internal/contracts"],"working_directory":".","timeout_seconds":120,"summary":"Green both before this artifact was registered (6 pre-existing index entries) and after (7 entries including this one). Includes TestActiveEvidenceIndex, which enforces a bijection between .agents/v2/evidence/*.json and the index entries, validates this artifact against contracts/schemas/evidence.json, recomputes evidence_hash as sha256 of this artifact's bytes, and confirms .agents/v2/task-state/V2-010.json (task_id referenced by this evidence) exists; and TestTaskPacketsValidate."},{"name":"ownership","status":"passed","argv":["devbox","run","--pure","--","make","ownership"],"working_directory":".","timeout_seconds":120,"summary":"Confirms every tracked file, including the two new test files and this evidence artifact, is owned by exactly one component per the ci-plan ownership manifest."},{"name":"candidate-check","status":"passed","argv":["devbox","run","--pure","--","make","check"],"working_directory":".","timeout_seconds":2400,"summary":"Executed AFTER commit B (the commit containing this artifact and its index entry) exists, not before, per docs/architecture/validation.md section 11 and docs/operations/v2-task-dag.md section 10: gitleaks git scans committed history only, so a make check run while this artifact (which contains a 64-hex evidence_key) was still uncommitted would not have scanned that content as committed history. secrets/gitleaks reports no leaks found, and the overall make check verdict is green at the commit that contains this registration."},{"name":"evidence-key-remeasured","status":"passed","argv":["devbox","run","--pure","--","make","evidence-keys"],"working_directory":".","timeout_seconds":120,"summary":"The domain evidence_key first read immediately after commit A (a2c191e9321dc11e3f06deac48ba7d79a23f0933) was 7a3448a0ce3877ec5131974e3abf5c7acb8d9c07c17a27221a1a4e54dc62ed20. A subsequent formatting-only commit (77d5f60, gofmt on the two new test files, no behavior change) changed the tracked content of internal/domain/**, which invalidated that key. All verification argv (go test -count=1 ./internal/domain, make component-domain, go list -deps ./internal/domain, make evidence-keys, go test -count=1 ./internal/contracts, make ownership) were re-run at the final tree (commit 77d5f60) and all passed; make evidence-keys at that tree reports the domain evidence_key as df57af1516e9984cef319a72e6756542905195b2af1e035ff7d3b3c9b870aefb, which is the value now recorded as this artifact's top-level evidence_key. Both keys are preserved here so the first observation is not erased: old=7a3448a0ce3877ec5131974e3abf5c7acb8d9c07c17a27221a1a4e54dc62ed20, new=df57af1516e9984cef319a72e6756542905195b2af1e035ff7d3b3c9b870aefb."}],"observed_at":"2026-08-24T12:37:56Z"}
