{"schema_version":"v1","id":"ev-v2-045-release","kind":"evidence","created_at":"2026-08-25T02:20:00Z","correlation_id":"v2-045-dependency-surface","task_id":"V2-045","component":"release","evidence_key":"df853759ddfa4f17f46efc848bb06758c54c766e15b7fe45fb8464f6de47d679","result":"passed","observed_at":"2026-08-25T02:20:00Z","checks":[{"name":"component-release","status":"passed","argv":["make","component-release"],"working_directory":".","timeout_seconds":1800,"summary":"The inner invocation cmd/ci-plan executed for this component during make evidence-all at base_commit=e37a2456ca386a062cff96441d79a7678a143b6c. The planner runs exactly argv=[make component-release] and writes build/evidence/release-<key>.json only if it exits zero. component=release evidence_key=df853759ddfa4f17f46efc848bb06758c54c766e15b7fe45fb8464f6de47d679 base_commit=e37a2456ca386a062cff96441d79a7678a143b6c."},{"name":"go-clean-testcache","status":"passed","argv":["devbox","run","--pure","--","go","clean","-testcache"],"working_directory":".","timeout_seconds":600,"summary":"Executed once before make evidence-all. make component-<id> does not pass -count=1, so without clearing the test cache an inner invocation could report a cached result. Clearing it makes every inner check in this run a real execution."},{"name":"evidence-all","status":"passed","argv":["devbox","run","--pure","--","make","evidence-all","EVIDENCE_TASK_ID=V2-045","EVIDENCE_CORRELATION_ID=v2-045-dependency-surface"],"working_directory":".","timeout_seconds":3600,"summary":"Outer invocation that produced this record's key. It selected all 23 components (--all) and ran each component's check target. Verdict line: {\"changed\":null,\"selected\":[...23 ids...],\"all\":true}; 23 record files in build/evidence."},{"name":"evidence-key-covers-dependency-surface","status":"passed","argv":["devbox","run","--pure","--","make","evidence-keys"],"working_directory":".","timeout_seconds":600,"summary":"Read at base_commit=e37a2456ca386a062cff96441d79a7678a143b6c after git add, so no new file was invisible to git ls-files. Key closure of release = [contracts domain internal-contracts release] (4 components, 6 patterns) plus the 7 unconditional paths [Makefile ci/components.json ci/key-closure.json devbox.json devbox.lock go.mod go.sum]. dependencies=[contracts domain] verification_dependencies=[]. Pre-change key at 26a499d was b37ce8874965ccd58d4a5e733a1f38726532df28cf6364d93c3578a6f1c1aec6; the new key is df853759ddfa4f17f46efc848bb06758c54c766e15b7fe45fb8464f6de47d679. One-byte probe on internal/application/service.go: pre-change key did NOT move, new key does not move (application is not in this closure). One-byte probe on Makefile: new key moves (pre-change algorithm moved only the environment component)."}]}