{"schema_version":"v1","id":"ev-v2-048-execution-identifier","kind":"evidence","created_at":"2026-08-24T15:07:43Z","correlation_id":"v2-048-execution-identifier","task_id":"V2-048","component":"docs","evidence_key":"0354cccc1699e8f031420e0fc7a58f4af313f088d588b43b76e8d18db46dcf79","result":"passed","checks":[{"name":"diff-scope","status":"passed","argv":["git","diff","--unified=0","docs/architecture/release-contract.md"],"working_directory":".","timeout_seconds":30,"summary":"Exactly one line of release-contract.md changes: the second bullet of section 7 now names the provider-issued execution identifier (session/execution ID) as retainable evidence, confined to an opaque identifier with no prompt, no response content and no credential, while restating in the same sentence that prompts and raw responses are not stored by default. No other line of section 7, or of the document, changes."},{"name":"docs-link-guard","status":"passed","argv":["devbox","run","--pure","--","make","docs"],"working_directory":".","timeout_seconds":60,"summary":"No reference to 01-core-principles.md or to any other deleted numbered document name remains in docs, README.md, or AGENTS.md after the section 7 edit."},{"name":"component-docs","status":"passed","argv":["devbox","run","--pure","--","make","component-docs"],"working_directory":".","timeout_seconds":60,"summary":"No TODO(ci) string appears anywhere under docs or README.md; the edited section 7 bullet introduces none."},{"name":"internal-contracts","status":"passed","argv":["devbox","run","--pure","--","go","test","-count=1","./internal/contracts"],"working_directory":".","timeout_seconds":120,"summary":"TestActiveEvidenceIndex passes: it recomputes evidence_hash as sha256 of file bytes for every artifact under .agents/v2/evidence, confirming this new V2-048-execution-identifier.json artifact matches its appended index entry and that the active-artifact set stays a bijection with the index; the entry's task_id V2-048 resolves to an existing task-state file. TestTaskPacketsValidate also passes."},{"name":"evidence-keys","status":"passed","argv":["devbox","run","--pure","--","make","evidence-keys"],"working_directory":".","timeout_seconds":120,"summary":"Executed at the final committed tree (commit dfd001e), after make check was confirmed green on that same tree. Reports the docs component evidence_key as 0354cccc1699e8f031420e0fc7a58f4af313f088d588b43b76e8d18db46dcf79, which is the value recorded as this artifact's top-level evidence_key. The docs component's key depends only on docs/**, README.md and AGENTS.md content plus ci/components.json, go.mod, go.sum and devbox.lock; this artifact and the index entry live under .agents/v2/evidence, which is outside the docs component's roots, so appending them afterward does not change the recorded key."},{"name":"candidate-check","status":"passed","argv":["devbox","run","--pure","--","make","check"],"working_directory":".","timeout_seconds":2400,"summary":"Executed after committing the release-contract.md section 7 edit (commit dfd001e) and again after committing this evidence artifact and the appended index entry, so gitleaks scans committed history that already includes every changed byte. The overall make check verdict is green at the final commit: all Go packages report ok, gitleaks reports no leaks found, and workflow-pins reports no disagreement."}],"observed_at":"2026-08-24T15:07:43Z"}
